csv_id;parent_id;pagetitle;longtitle;published;deleted;createdon;publishedon;content;description;introtext;article;price;old_price;weight;vendor_id;made_in;new;popular;favorite;color;tags;size;images
347;27;Цифровая системная консоль PANASONIC KX-T7440;Цифровая системная консоль PANASONIC KX-T7440;1;0;1533502800;1534021200;<p>Консоль для цифровых системных телефонов Panasonic включает 66 программируемых кнопок прямого выбора абонента, 66 кнопок поля индикаторов занятости линии.</p>;Цифровая системная консоль PANASONIC KX-T7440;Цифровая системная консоль PANASONIC KX-T7440;1597292934;970;970;0;1;Россия;0;0;1;"[""Красны"",""Синий"",""Оранжевый"",""Сереневый"",""Голубой""]";"[""MODX"",""Популярный"",""Не популярный"",""Устаревший"",""Новая модель""]";"[""10см"",""200см""]";products/85-150-thickbox.jpg
348;29;Пеленальный столик Baby Prestige Simplicity;Пеленальный столик Baby Prestige Simplicity;1;0;1533502800;1534021200;<p>Пеленальный столик очень устойчив благодаря широкой основе. Ванночка анатомической формы с дренажной трубкой для слива воды. Имеется полочка для хранения банных принадлежностей. Занимает мало места. Высота - 98 см. Длина - 75 см. Ширина - 58 см.</p>;Пеленальный столик Baby Prestige Simplicity;Пеленальный столик Baby Prestige Simplicity;227433105;910,8;910,8;0;1;Россия;0;0;0;"[""Красны"",""Синий"",""Оранжевый"",""Сереневый"",""Голубой""]";"[""MODX"",""Популярный"",""Не популярный"",""Устаревший"",""Новая модель""]";"[""10см"",""200см""]";products/31-73-thickbox.jpg
349;29;Миксер Philips HR1565;Миксер Philips HR1565;1;0;1533502800;1534021200;<p>Легкое приготовление домашних дессертов Миксер с поворачивающейся чашей Приготовление изысканных домашних тортов, пирогов и выпечки для всей семьи еще никогда не было настолько простым. Этот 350 Вт миксер Philips с подставкой и чашей сделает за вас всю трудную работу, за минуты приготовив идеальные смеси. Ваш верный и надежный помощник на кухне.</p><p>Свободные руки при смешивании Вращающаяся чаша емкостью 3 л Подставка миксера</p><p>Идеальное тесто и десерты за несколько минут Мощный (350 Ватт) мотор Различные скоростные режимы и турборежим</p><p>Идеально взбивает и смешивает Насадки для взбивания и для теста в комплекте</p><p>Быстрая и простая чистка Удобная лопаточка</p><p>Удобство хранения Зажим для шнура</p><p>Общие характеристики Режимы скоростей: 3 Кнопка включения турборежима Зажим для шнура</p><p>Технические характеристики Мощность: 350 Вт Напряжение: 230-240 В Частота: 50/60 Гц Длина шнура: 1,50 м</p><p>Характеристики дизайна Материал, из которого изготовлен корпус: ABS Материал насадок для взбивания/для теста: Из нержавеющей стали</p><p>Принадлежности Насадки для взбивания Насадки для теста</p><p>Дата выпуска 2008-05-21</p>;Миксер Philips HR1565;Миксер Philips HR1565;1672810800;900,9;900,9;0;1;Россия;0;1;0;"[""Красны"",""Синий"",""Оранжевый"",""Сереневый"",""Голубой""]";"[""MODX"",""Популярный"",""Не популярный"",""Устаревший"",""Новая модель""]";"[""10см"",""200см""]";products/5-12-thickbox.jpg
350;36;Стайлер Braun Satin Hair 5 ESW;Стайлер Braun Satin Hair 5 ESW;1;0;1533502800;1534021200;<p>Стайлер для выпрямления волос. Подвижные керамические пластины NanoGlide поддерживают здоровье кутикулы. Точная регулировка температуры для бережной укладки (от 130°C до 200°C с шагом в 5°C). Формирователь локонов. Температурный дисплей. Автоматическое отключение через 30 минут.</p>;Стайлер Braun Satin Hair 5 ESW;Стайлер Braun Satin Hair 5 ESW;715993455;900;950;0;1;Россия;0;0;0;"[""Красны"",""Синий"",""Оранжевый"",""Сереневый"",""Голубой""]";"[""MODX"",""Популярный"",""Не популярный"",""Устаревший"",""Новая модель""]";"[""10см"",""200см""]";products/122-216-thickbox.jpg
351;43;Вязаное платье с нарядным воротничком;Вязаное платье с нарядным воротничком;1;0;1533502800;1534021200;<p>Это отличное вязаное платье с шикарным воротником</p><p>А сборка в области талии подчеркнёт все прелести вашей фигуры.</p>;Вязаное платье с нарядным воротничком;Вязаное платье с нарядным воротничком;402661365;900;950;0;1;Россия;0;0;0;"[""Красны"",""Синий"",""Оранжевый"",""Сереневый"",""Голубой""]";"[""MODX"",""Популярный"",""Не популярный"",""Устаревший"",""Новая модель""]";"[""10см"",""200см""]";products/146-272-thickbox.jpg
352;43;Спортивный костюм HOOD;Спортивный костюм HOOD;1;0;1533502800;1534021200;<p>100% хлопок</p>;Спортивный костюм HOOD;Спортивный костюм HOOD;264887605;900;950;0;1;Россия;0;0;0;"[""Красны"",""Синий"",""Оранжевый"",""Сереневый"",""Голубой""]";"[""MODX"",""Популярный"",""Не популярный"",""Устаревший"",""Новая модель""]";"[""10см"",""200см""]";products/149-284-thickbox.jpg
353;33;Гидромассажная ванна для ног BEURER FB25;Гидромассажная ванна для ног BEURER FB25;1;0;1533502800;1534021200;<p>Гидромассажная ванночка для ног с механическим управлением и тремя режимами работы. 16 встроенных магнитов. Вибрационный массаж, вихревой массаж. Дополнительная функция: поддержание температуры воды.</p>;Гидромассажная ванна для ног BEURER FB25;Гидромассажная ванна для ног BEURER FB25;1285920550;89;89;0;1;Россия;0;0;0;"[""Красны"",""Синий"",""Оранжевый"",""Сереневый"",""Голубой""]";"[""MODX"",""Популярный"",""Не популярный"",""Устаревший"",""Новая модель""]";"[""10см"",""200см""]";products/112-205-thickbox.jpg
354;43;Платье Зебра с оригинальным ремнем;Платье Зебра с оригинальным ремнем;1;0;1533502800;1534021200;<p>Красивое платье для работы и отдыха из плотного стрейч-трикотажа.</p><p>Высококачественный плотный трикотаж с добавлением эластана делает платье комфортным и удобным в носке.</p><p>Оригинальный ремень и необычная расцветка покажут Вашу индивидуальность и стиль.</p><p>Параметры модели: рост 176см, ОГ - 88см, ОТ -65 см, ОБ-94 см.</p>;Платье Зебра с оригинальным ремнем;Платье Зебра с оригинальным ремнем;997196776;85;85;0;1;Россия;0;0;0;"[""Красны"",""Синий"",""Оранжевый"",""Сереневый"",""Голубой""]";"[""MODX"",""Популярный"",""Не популярный"",""Устаревший"",""Новая модель""]";"[""10см"",""200см""]";products/145-268-thickbox.jpg
355;27;Газовая плита Ardo D662 RNS;Газовая плита Ardo D662 RNS;1;0;1533502800;1534021200;<p>Тип плиты газовая</p><p>Тип духовки газовая</p><p>Цвет чёрный</p><p>Высота, cм 85</p><p>Ширина, см 60</p><p>Глубина, cм 60</p><p>Количество конфорок (газ+электро) 4+0</p><p>Газ-контроль конфорок есть</p><p>Газ-контроль духовки и гриля есть</p><p>Тип решеток чугун</p><p>Гриль газовый</p><p>Вертел есть</p><p>Электроподжиг автоматический</p><p>Подсветка есть</p><p>Термостат есть</p><p>Двойное стекло дверей духовки есть</p><p>Объем духовки, л 56</p>;Газовая плита Ardo D662 RNS;Газовая плита Ardo D662 RNS;1315964705;840;0;0;1;Россия;1;0;0;"[""Красны"",""Синий"",""Оранжевый"",""Сереневый"",""Голубой""]";"[""MODX"",""Популярный"",""Не популярный"",""Устаревший"",""Новая модель""]";"[""10см"",""200см""]";products/19-40-thickbox.jpg
356;33;Фен-расческа Braun Steam & Style ASS 1000;Фен-расческа Braun Steam & Style ASS 1000;1;0;1533502800;1534021200;<p>Мощный стайлер с управлямой подачей пара. Мягкая укладка и длительный результат. Идеален для укладки влажных волос и корректировки прически на сухих волосах, для создания локонов и волн, создания объема. 3 ступени мощности потока воздуха. Насадка для создания крупных локонов и волн. Насадка для мелкой и средней завивки. Насадка для подъема волос и создания объема от самых корней. Цвет сиреневый матовый.</p>;Фен-расческа Braun Steam & Style ASS 1000;Фен-расческа Braun Steam & Style ASS 1000;1529306471;83;0;0;1;Россия;0;0;0;"[""Красны"",""Синий"",""Оранжевый"",""Сереневый"",""Голубой""]";"[""MODX"",""Популярный"",""Не популярный"",""Устаревший"",""Новая модель""]";"[""10см"",""200см""]";products/113-206-thickbox.jpg
357;39;Штатив Rekam RT-L38;Штатив Rekam RT-L38;1;0;1533502800;1534021200;<p>Напольный штатив для фото- и видеокамер. Корпус выполнен из металла серебристого цвета, ручка для переноса, механический подъемник, крюк для сумки, панорамная 3-D головка.</p>;Штатив Rekam RT-L38;Штатив Rekam RT-L38;633126586;81;0;0;1;Россия;0;0;0;"[""Красны"",""Синий"",""Оранжевый"",""Сереневый"",""Голубой""]";"[""MODX"",""Популярный"",""Не популярный"",""Устаревший"",""Новая модель""]";"[""10см"",""200см""]";products/135-235-thickbox.jpg
358;29;Пневмогайковерт Force 82565;Пневмогайковерт Force 82565;1;0;1533502800;1534021200;<p>Скорость вращения 6000 об/мин, максимальное усилие 1800 Нм, вес 4.4 кг.</p>;Пневмогайковерт Force 82565;Пневмогайковерт Force 82565;1751310486;800,8;0;0;1;Россия;0;0;1;"[""Красны"",""Синий"",""Оранжевый"",""Сереневый"",""Голубой""]";"[""MODX"",""Популярный"",""Не популярный"",""Устаревший"",""Новая модель""]";"[""10см"",""200см""]";products/64-115-thickbox.jpg
359;27;Мобильный телефон HTC Sensation XE;Мобильный телефон HTC Sensation XE;1;0;1533502800;1534021200;<p>Смартфон, выполненный в форм-факторе моноблок оснащен двухядерным процессором 1.5 ГГц и ОС Android 2.3. 4.3 дюймовый SLCD дисплей с разрешением 540 х 960 пикселей способный отображать до 16 млн. цветов. Встроенная память телефона 4 Гб. Слот для карт памяти формата microSD, microSDНС. Интерфейсы: Вluetooth, USB, Wi-Fi. Встроенный приемник GPS. Встроена 8-ми мегапиксельная камера с автофокусом, светодиодной вспышкой и функцией записи видео. Аудио разъем 3.5 мм. Аккумулятор емкостью 1730 мАч обеспечивает работу до 9 часов в режиме разговора, до 540 часов в режиме ожидания.</p>;Мобильный телефон HTC Sensation XE;Мобильный телефон HTC Sensation XE;309877490;800;0;0;1;Россия;0;0;0;"[""Красны"",""Синий"",""Оранжевый"",""Сереневый"",""Голубой""]";"[""MODX"",""Популярный"",""Не популярный"",""Устаревший"",""Новая модель""]";"[""10см"",""200см""]";products/72-126-thickbox.jpg
360;29;Чаеварка-чайник BOSCH TTA 2009;Чаеварка-чайник BOSCH TTA 2009;1;0;1533502800;1534021200;<p>Цвет: бежевый/серый, серебристый</p><p>Мощность: 1785 Вт макс.</p><p>Объем заварника: 0,7 л</p><p>Объем чайника: 2,0 л</p><p>Чайник из полупрозрачного пластика со шкалой уровня воды</p><p>Стеклянный заварник с крышкой</p><p>Ситечко для заварки из нержавеющей стали</p><p>Круговой светоиндикатор «Улыбка»</p><p>Крышка для чайника в комплекте</p><p>Скрытый нагревательный элемент, дно из нержавеющей стали</p><p>Автоматическое переключение на режим подогрева</p><p>Цоколь с центральным контактом позволяет устанавливать чайник в любом положении</p><p>Клавиша переключения режимов кипячения и нагрева</p><p>Клавиша «включения/отключения» прибора</p><p>Намотка кабеля в цоколе</p>;Чаеварка-чайник BOSCH TTA 2009;Чаеварка-чайник BOSCH TTA 2009;2021101469;80,7;0;0;1;Россия;0;1;0;"[""Красны"",""Синий"",""Оранжевый"",""Сереневый"",""Голубой""]";"[""MODX"",""Популярный"",""Не популярный"",""Устаревший"",""Новая модель""]";"[""10см"",""200см""]";products/11-23-thickbox.jpg
361;27;Тостер KRUPS FEM2 ToastExpert;Тостер KRUPS FEM2 ToastExpert;1;0;1533502800;1534021200;<p>Технические характеристикиМощность 1100 ВтКоличество отделений 2Количество тостов 2Тип управления механическоеРегулировка степени поджаривания есть, 8Кнопка отмены естьОсобенностиПоддон для крошек есть</p>;Тостер KRUPS FEM2 ToastExpert;Тостер KRUPS FEM2 ToastExpert;1712530575;80;0;0;1;Россия;0;0;0;"[""Красны"",""Синий"",""Оранжевый"",""Сереневый"",""Голубой""]";"[""MODX"",""Популярный"",""Не популярный"",""Устаревший"",""Новая модель""]";"[""10см"",""200см""]";products/8-18-thickbox.jpg
362;30;Парсер товаров focalprice.com;Парсер товаров focalprice.com;1;0;1533502800;1534021200;"<p>Парсер focalprice.com – отдельная и специальная сборка парсера Catalog Loader для скачивания товаров из интернет-магазина focalprice.com.</p><p>Преимущества парсера focalprice.com перед аналогами: - Программа работает под Windows (XP / 7 / 2003 / 2008). - Установка программы не требует никаких специальных знаний и навыков, устанавливается как обычное приложение Windows (далее, далее… готово). - Максимально упрощенный и понятный интерфейс. Парсером focalprice.com извлекается: - Структура каталога - Имя товара - Артикул - Краткое описание товара (в качестве краткого описания Имя товара) - Полное описание товара (без разбиения на параметры, ссылки (ссылки на картинки) в тексте описания удаляются) - Изображение (1-6шт.) - Цена (если имеется скидка на товара, берется цена по скидке) - meta_title?, meta_description?, meta_keywords;? - Возможно расширение стандартной версии дополнительными параметрами и возможностями (изменение цены по формуле, разбиение описания на характеристики, мониторинг и сравнение цен и т.д.). Экспорт товаров парсером focalprice.com происходит в csv для следующих CMS: - PrestaShop, - VamShop, - Virtuemart(Joomla), - ShopScript, - ABO, - Amiro, - PhpShop, - HostCMS, - возможно подключение любой другой CMS или нужного формата csv (бесплатно). Возможность возобновления процесса парсинга с предыдущего состояние в случае какого-либо сбоя (выкл. электричества и т.п. ) или ручной остановки парсера. После оформления заказа Вам будет выслана ссылка на скачивание программы.</p><p>Наш продукт ShopDataGetway - это система предоставляющая вашим партнерам возможность мгновенно обновлять интернет-магазины используя данные из ваших систем. Система предоставляет вашим партнерам данные в требуемом им виде. С помощью продукта ShopDataGetway вы позволяете вашим партнерам избежать лишних затрат на автоматизицию бизнес-процессов.</p><p>CatalogLoader– это пакет программного обеспечение, представляющее собой набор инструментов для работы с товарамиинтернет-магазинов (парсер, автоматическое наполнение, изменение цен, обработка склада, мониторинг конкурентов).</p>";Парсер товаров focalprice.com;Парсер товаров focalprice.com;744500286;79;0;0;1;Россия;0;0;0;"[""Красны"",""Синий"",""Оранжевый"",""Сереневый"",""Голубой""]";"[""MODX"",""Популярный"",""Не популярный"",""Устаревший"",""Новая модель""]";"[""10см"",""200см""]";products/139-252-thickbox.jpg
363;27;Пылесос промышленный FA-SA DOMINO 78 inox;Пылесос промышленный FA-SA DOMINO 78 inox;1;0;1533502800;1534021200;<p>2 тихих двухстадийных двигателя (Domino), металлические профессиональные закрывающие замки, поплавковый клапан, полностью снимаемая верхняя часть, защита от статического электричества, силовой кабель 7 м, легко снимается основа (во время очистки фильтра), всасывающая система с байпасным охлаждением, ударопрочная тележка устойчивая к воздействию химикатов и высоких температур.</p>;Пылесос промышленный FA-SA DOMINO 78 inox;Пылесос промышленный FA-SA DOMINO 78 inox;1071158422;785;0;2;1;Россия;0;0;0;"[""Красны"",""Синий"",""Оранжевый"",""Сереневый"",""Голубой""]";"[""MODX"",""Популярный"",""Не популярный"",""Устаревший"",""Новая модель""]";"[""10см"",""200см""]";products/65-116-thickbox.jpg
364;40;Объектив Canon EF 70-200 f 4L USM;Объектив Canon EF 70-200 f 4L USM;1;0;1533502800;1534021200;<p>Телеобъектив с постоянной светосилой. Модель выполнена в прочном, пыле- и влагозащитном корпусе. Диафрагма объектива с круглым отверстием позволяет получать привлекательный эффект размытого фона. Оптическая схема объектива включает 13 линз в 16 группах. В числе элементов имеются две линзы из низкодисперсионного стекла UD и одна флюоритовая. Такая конструкция обеспечивает превосходное качество изображения с минимальным уровнем аберраций при любом значении фокусного расстояния. Многослойное просветление Super Spectra. Фокусировка осуществляется при помощи кольцевого ультразвукового мотора USM.</p>;Объектив Canon EF 70-200 f 4L USM;Объектив Canon EF 70-200 f 4L USM;968172589;775;0;0;1;Россия;0;0;0;"[""Красны"",""Синий"",""Оранжевый"",""Сереневый"",""Голубой""]";"[""MODX"",""Популярный"",""Не популярный"",""Устаревший"",""Новая модель""]";"[""10см"",""200см""]";products/133-231-thickbox.jpg
365;27;Bluetooth гарнитура Plantronics Voyager 835;Bluetooth гарнитура Plantronics Voyager 835;1;0;1533502800;1534021200;<p>Гарнитура сочетает в себе сразу три технологии шумоподавления, которые в совокупности обеспечивают идеальную ясность и естественное звучание голоса в обоих направлениях. Технология Multipoint позволяет использовать данную гарнитуру для работы сразу с двумя Bluetooth устройствами. Работает до 5 часов в режиме разговора и до 7 дней в режиме ожидания. В комплекте с гарнитурой поставляется зарядное устройство от сети, а также уникальное автомобильное зарядное устройство.</p>;Bluetooth гарнитура Plantronics Voyager 835;Bluetooth гарнитура Plantronics Voyager 835;1114508056;75;0;0;1;Россия;0;0;0;"[""Красны"",""Синий"",""Оранжевый"",""Сереневый"",""Голубой""]";"[""MODX"",""Популярный"",""Не популярный"",""Устаревший"",""Новая модель""]";"[""10см"",""200см""]";products/75-135-thickbox.jpg
