csv_id;parent_id;pagetitle;longtitle;published;deleted;createdon;publishedon;content;description;introtext;article;price;old_price;weight;vendor_id;made_in;new;popular;favorite;color;tags;size;images
407;27;Бетономешалка Power Tec BWE180/140;Бетономешалка Power Tec BWE180/140;1;0;1533502800;1534021200;<p>Бетономешалка с загрузкой и выгрузкой с обеих сторон. Выгрузка на высоте тележки. Ёмкость барабана: 180 л. Рабочая ёмкость: 140 л. Производительность: 1,1 м3/ч. Мощность двигателя: 0,55-0,75 кВт. Вес: 73 кг.</p>;Бетономешалка Power Tec BWE180/140;Бетономешалка Power Tec BWE180/140;196049201;320;320;3;2;;0;0;1;;;;products/53-105-thickbox.jpg
408;28;Директорское кресло VIP класса Status Extra;Директорское кресло VIP класса Status Extra;1;0;1533502800;1534021200;<p>Директорское кресло VIP класса Status Extra для руководителя,дома и офиса. СТАТУС дерево натуральная кожа 100% люкс LE-16/K цвет бренди Кожаное кресло VIP класса для руководителя,дома и офиса. Широкое мягкое сиденье и высокая спинка с механизмом трансформации. Удобные мягкие кожаные подлокотники . Элегантная металическая крестовина с деревянными накладками,точенный из масива чехол пневмо-целиндра. Кресло комплектуется механизмом ТРАНСФОРМАЦИИ который обеспечивает разложение кресла практически в горизонтальное положение. Обивка кресла натуральная кожа высшего качества LUX 100%. выделки Extra - мягкая и эластичная.</p>;Директорское кресло VIP класса Status Extra;Директорское кресло VIP класса Status Extra;441212364;21200;21200;0;3;;1;0;1;;;;products/48-99-thickbox.jpg
409;20;Стульчик для кормления Peg-Perego Prima Pappa Best;Стульчик для кормления Peg-Perego Prima Pappa Best;1;0;1533502800;1534021200;<p>Стульчик раcсчитан на малыша до трех лет. Моющееся сидение изготовлено из кожа заменителя, корпус пластмассовый, регулируемая подножка, стопора на колесах, большая устойчивость. Пятиточечные ремни безопасности и анатомическая вставка для разделения ног удерживают ребенка в надежном и безопасном положении.</p>;Стульчик для кормления Peg-Perego Prima Pappa Best;Стульчик для кормления Peg-Perego Prima Pappa Best;1360727340;306;306;0;3;;0;0;0;"[""Синий"",""Оранжевый"",""Сереневый"",""Голубой""]";"[""Устаревший""]";"[""100см""]";products/97-174-thickbox.jpg
410;23;Радиотелефон DECT Siemens Gigaset SL785;Радиотелефон DECT Siemens Gigaset SL785;0;0;1533502800;1534021200;<p>Стильный и удобный телефон в металлическом корпусе. Встроенный автоответчик с записью на 45 минут. Гарнитура с Bluetooh® и дуплексный режим hands-free. Большой цветной TFT-дисплей с инновационным интерфейсом. Технология ECO Mode Plus с режимом нулевой передачи. Адресная книга на 500 записей. Возможность обмена данными из адресной книги через Bluetooth® с мобильными телефонами. Индикация номера. Синхронизация с компьютером через Bluethooth®/USB. Возможна регистрация до 6 трубок.</p>;Радиотелефон DECT Siemens Gigaset SL785;Радиотелефон DECT Siemens Gigaset SL785;654249275;304;304;0;3;;0;0;0;;;;products/111-204-thickbox.jpg
411;29;Детское автокресло Bebe Confort Iseos Safe Side TT;Детское автокресло Bebe Confort Iseos Safe Side TT;1;0;1533502800;1534021200;<p>Автокресло рекомендуется для детей от 9 кг (1-4 года). Оснащено системой дополнительного натяжения ремней, которыми кресло крепится к сиденью автомобиля, что упрощает и ускоряет его правильную установку. Установка в автомобиле: по ходу движения с помощью штатного 3-точечного ремня безопасности. В кресле используется двойная система Modulo Safe, позволяющая плавно изменять ширину (от 40 до 55 см) и наклон кресла, внутренние 5-точечные ремни безопасности регулируются по росту ребенка. Прочный корпус на широкой платформе разработан с учетом геометрии салонов современных автомобилей. Усиленная боковая защита Safe Side. Защитные накладки на ремнях двух размеров, в зависимости от возраста ребенка. Система Легкая посадка, фиксирующая внутренние ремни по сторонам, на боковинах и не мешающие посадке ребенка. Высококачественное, мягкое, дышащее покрытие (снимается и стирается). Система Total Tension обеспечивает правильную установку с меньшими усилиями. Вес автокресла: 9 кг.</p>;Детское автокресло Bebe Confort Iseos Safe Side TT;Детское автокресло Bebe Confort Iseos Safe Side TT;950517247;300,99;300,99;0;3;;0;0;0;;;;products/21-42-thickbox.jpg
412;27;Маятниковый лобзик с электроникой Metabo STEB 135;Маятниковый лобзик с электроникой Metabo STEB 135;1;0;1533502800;1534021200;<p>Энергичный распил в деревянной заготовке толщиной до 135 мм. Легкая и быстрая замена пильного диска, низко расположенный опорный ролик пильного полотна, быстрая фиксация направляющей панели для наклонного распила. Оптимальное удобство обращения благодаря эргономичному дизайну, прорезиненная рукоятка-скоба, устройство воздуходува, обеспечивающее просматриваемость области резания.</p>;Маятниковый лобзик с электроникой Metabo STEB 135;Маятниковый лобзик с электроникой Metabo STEB 135;1982777364;300;300;5;3;;0;0;0;;;;products/58-110-thickbox.jpg
413;27;Автомобильная громкая связь NEON BTHF009Dsp;Автомобильная громкая связь NEON BTHF009Dsp;1;0;1533502800;1534021200;<p>Комплект беспроводной громкой связи NEON поддерживает функции Определитель номера, Голосовой набор, Повторный набор последнего номера, Отложенный звонок  и Переключение вызова. Переключение между функциями осуществляется при помощи многофункциональной клавиши, размещенной на лицевой панели. Версия BLUETOOTH: 2.0. Поддержка профилей: Наушники и Handsfree. Рабочее расстояние: 10 м (класс 2). Экран LCD отображает номер звонящего из 12 цифр. Шумоподавления и устранение эха.</p>;Автомобильная громкая связь NEON BTHF009Dsp;Автомобильная громкая связь NEON BTHF009Dsp;1654778539;300;330;0;3;;0;0;0;;;;products/77-137-thickbox.jpg
414;44;Бюстгальтер Velmont 3404;Бюстгальтер Velmont 3404;1;0;1533502800;1534021200;<p>Бюстгальтер Velmont 3404 – эффектный бюстгальтер. Тонкие, регулируемые лямки, удобная чашка, кружевная отделка, Ваша грудь будет сексуально выглядеть в этом бюстгальтере. Удобен в носке и подходит как на каждый день, так и под вечернее платье.</p>;Бюстгальтер Velmont 3404;Бюстгальтер Velmont 3404;665098649;300;330;0;3;;0;0;0;;;;products/150-287-thickbox.jpg
415;44;Бюстгальтер Velmont 5104;Бюстгальтер Velmont 5104;1;0;1533502800;1534021200;<p>Бюстгальтер Velmont 5104 привлекает внимание оригинальностью расцветки и отделки. Бюстгальтер на регулируемых тонких лямках, глубокая удобная чашка, идеально поддерживающая грудь. Удобен в носке на каждый день, идеально подходит для открытых сарафанов и прозрачных топов.</p>;Бюстгальтер Velmont 5104;Бюстгальтер Velmont 5104;664902047;300;330;0;3;;0;0;0;;;;products/152-289-thickbox.jpg
416;44;Бюстгальтер Velmont 3804;Бюстгальтер Velmont 3804;1;0;1533502800;1534021200;<p>Бюстгальтер Velmont 3804 – удобный бюстгальтер на регулируемых тонких лямках. Легкая отделка кружевом, четный цвет, он привлекает внимание классической простотой. Удобная, мягкая чашечка идеально поддержит Вашу грудь. Бюстгальтер подходит к носке на каждый день.</p>;Бюстгальтер Velmont 3804;Бюстгальтер Velmont 3804;665360793;300;330;0;3;;0;0;0;;;;products/153-290-thickbox.jpg,products/152-289-thickbox.jpg
417;29;Скобозабиватель Metabo Ta E 2019;Скобозабиватель Metabo Ta E 2019;1;0;1533502800;1534021200;<p>Модель для работы со скобами, гвоздями, профильными захватами Metabo. Подходит также для работы со скобами из плоской проволоки. Энергия удара может плавно регулироваться электронным образом. Возможность дополнительного добивания (для скоб и гвоздей). Выступ с выемкой для точного позиционирования. Защита от случайного срабатывания удара.</p>;Скобозабиватель Metabo Ta E 2019;Скобозабиватель Metabo Ta E 2019;829457920;290,99;290,99;0;3;;0;0;1;;;;products/66-117-thickbox.jpg
418;22;Высечные ножницы Bosch GNA 16 (SDS) Professional;Высечные ножницы Bosch GNA 16 (SDS) Professional;0;0;1533502800;1534021200;<p>Изящная, узкая конструкция для оптимального удобства в обращении. Используется для внутренних вырезов. Свободная работа по разметке и шаблону. Фиксируемая матрица для прямых прорезов, замена пуансона и матрицы без инструмента (система SDS). Легкосменные режущие инструменты.</p>;Высечные ножницы Bosch GNA 16 (SDS) Professional;Высечные ножницы Bosch GNA 16 (SDS) Professional;153646461;290;290;0;3;;0;0;0;;;;products/103-187-thickbox.jpg
419;44;Бюстгальтер Velmont 4702;Бюстгальтер Velmont 4702;1;0;1533502800;1534021200;<p>Бюстгальтер Velmont 4702 – комфортный бюстгальтер на регулируемых тонких лямках. Черный атлас, удобная чашка, бюстгальтер привлекает внимание эффектной простотой. Идеально поддержит Вашу грудь, удобен в носке на каждый день.</p>;Бюстгальтер Velmont 4702;Бюстгальтер Velmont 4702;1047370142;29;29;0;3;;0;0;0;;;;products/151-288-thickbox.jpg
420;22;Оптический нивелир Bosch GOL 20 D Professional;Оптический нивелир Bosch GOL 20 D Professional;0;0;1533502800;1534021200;<p>Оптический нивелир с точность нивелирования 3 мм на 30 м. Рабочий диапазон: до 60 м. Оптимально подходит для использования вне помещений благодаря прочному корпусу с защитой от пыли и брызг IP 54. Светосильный объектив для чёткого захвата цели. Пентапризма для удобства считывания показаний сферического уровня. Коллиматор для грубого выравнивания. Вертикальное изображение. Большая кнопка фокусировки для простого выравнивания.Бесконечный микрометренный привод (измерение в гонах) с проскальзывающей муфтой.</p>;Оптический нивелир Bosch GOL 20 D Professional;Оптический нивелир Bosch GOL 20 D Professional;1331499396;285;285;0;3;;1;0;1;"[""Голубой""]";;;products/101-182-thickbox.jpg
421;27;Радиотелефон Dect Panasonic KX-TG8286;Радиотелефон Dect Panasonic KX-TG8286;1;0;1533502800;1534021200;<p>Комплектация база, две трубки. Радиус действия в помещении / на открытой местности 50 / 300 м. Цифровой автоответчик, на 40 минут. Память последних 10 набранных номеров. Полифонические мелодии 20. Автодозвон, будильник, блокировка клавиатуры от случайного нажатия, разъем для гарнитуры. Ночной режим, избирательный звонок, тип дополнительных трубок KX-TGA828. Дисплей на базовом блоке, на трубке (цветной). Подсветка кнопок на трубке. Возможность настенного крепления. Наборное поле на базе. АОН/Caller ID, журнал на 50 номеров. Громкая связь (спикерфон). Внутренняя связь (интерком) между несколькими трубками. Конференц-связь (между базой, трубкой/трубками и внешним абонентом).</p>;Радиотелефон Dect Panasonic KX-TG8286;Радиотелефон Dect Panasonic KX-TG8286;1755532483;272;272;0;3;;0;0;0;;;;products/80-142-thickbox.jpg
422;29;Бензобур Pacme EL-ED1700;Бензобур Pacme EL-ED1700;1;0;1533502800;1534021200;<p>Бензобур мощностью 1.7 кВт. Диаметр бура 150 мм. Возможность установки буров диаметром: 100, 200, 250 мм.</p>;Бензобур Pacme EL-ED1700;Бензобур Pacme EL-ED1700;1020478280;260,6;260,6;0;3;;0;0;1;;;;products/51-103-thickbox.jpg
423;27;Мобильный телефон LG KG810;Мобильный телефон LG KG810;1;0;1533502800;1534021200;<p>Качественный материал корпуса, выбор черного цвета, сдержанность, знающая себе цену. Этот имиджевый аксессуар обладает достаточной мультимедийной мощью. Сенсорные клавиши. TFT дисплей, отображающий 262000 цветов. 64-х голосная полифония. Встроенная 1.3 мегапиксельная камера. Прием и отправка SMS, EMS, MMS, E-mail. МР3/AAC/MP4 плеер. FM-радио. Bluetooth.</p>;Мобильный телефон LG KG810;Мобильный телефон LG KG810;172494359;260;260;0;3;;0;0;1;;;;products/73-130-thickbox.jpg
424;27;Светильник на зеркало K-26 MARTA тюльпан;Светильник на зеркало K-26 MARTA тюльпан;1;0;1533502800;1534021200;<p>Цвет: хром 230V E14 Max 40WТорговая марка: MARTA Производство: Польша</p>;Светильник на зеркало K-26 MARTA тюльпан;Светильник на зеркало K-26 MARTA тюльпан;304794229;26;26;0;4;Россия;0;0;1;;;;products/47-98-thickbox.jpg
425;28;Компрессор Remeza СБ4С270.АВ670;Компрессор Remeza СБ4С270.АВ670;1;0;1533502800;1534021200;<p>Используется в бытовых целях и промышленных условиях как источник сжатого воздуха для пневмоинструмента, окрасочных работ, автосервиса и т. д.</p>;Компрессор Remeza СБ4С270.АВ670;Компрессор Remeza СБ4С270.АВ670;807438575;24150;25150;0;4;Россия;1;0;0;;;;products/57-109-thickbox.jpg
426;27;Сварочный генератор EUROPOWER EP-200X2;Сварочный генератор EUROPOWER EP-200X2;1;0;1533502800;1534021200;<p>Сварочный генератор производится на базе четырехтактного бензинового двигателя с воздушным охлаждением HONDA GX390. Предназначен для использования в качестве автономного источника питания и для ручной дуговой сварки постоянным током. Возможность работы в двух режимах - сварочного аппарата и электростанции. Максимальный сварочный ток: 200 A. Номинальный сварочный ток: 140 A. Мощность однофазного (230В) тока, кВт: 4. Диаметр электрода: до 4 мм (включительно). Расход: 2.7 л/ч. Объем бака: 6.5 л. Стартер: ручной. Уровень шума: 74 дБ.</p>;Сварочный генератор EUROPOWER EP-200X2;Сварочный генератор EUROPOWER EP-200X2;1854076646;2469;2469;3;4;Россия;1;1;0;;;;products/60-111-thickbox.jpg
427;28;Коммуникатор ASUS MyPal A639;Коммуникатор ASUS MyPal A639;1;0;1533502800;1534021200;<p>Операционная система Windows Mobile 5.0 for Pocket PC. Процессор Intel XScale PXA270 416 МГц. Оперативная память 64 Мб, Flash-память ROM 1 Гб. Интерфейсы: SD/MMC с поддержкой SDIO, IrDA, Bluetooth 2.0+EDR, Wi-Fi (IEEE802.11b/g), USB 1.1 клиент (синхронизация, заряд, кард-ридер). Встроенный GPS-приемник SiRF Star III, внешняя поворотная антенна, разъем для подключения дополнительной антенны. Экран 3.5” c разрешением 240х320 точек, 64 тысячи цветов.</p>;Коммуникатор ASUS MyPal A639;Коммуникатор ASUS MyPal A639;1542096497;24530;24530;0;4;Россия;0;1;0;;;;products/91-156-thickbox.jpg
428;28;Коляска Hauck Condor;Коляска Hauck Condor;1;0;1533502800;1534021200;<p>Прогулочная коляска. Регулируемый наклон спинки. Регулируемая подножка. Солнцезащитный козырек со смотровым окошком. Пятиточечный ремень безопасности. Съемный поручень. Тканевые части коляски можно стирать. Дождевик. Вес 10 кг.</p>;Коляска Hauck Condor;Коляска Hauck Condor;1827331686;24312;24312;5;4;Россия;1;0;1;;;;products/25-56-thickbox.jpg
429;28;Манеж-кровать Capella C1;Манеж-кровать Capella C1;1;0;1533502800;1534021200;<p>Двухуровневый просторный манеж-кровать с пеленальным столиком. Вибромузыкальный блок успокоит ребенка и поможет ему заснуть. Быстрый и безопасный механизм складывания-раскладывания манежа. Колесные фиксаторы позволяют свободно передвигать манеж-кровать. Кольца-держатели, с помощью которых ребенок сможет подтянуться и встать на ножки. Боковой лаз на молнии. Центральная ножка манежа обеспечивает дополнительную устойчивость.</p>;Манеж-кровать Capella C1;Манеж-кровать Capella C1;1848786829;23194;23194;2;4;Россия;0;0;0;;;;products/29-67-thickbox.jpg
430;29;Ортопедический матрас Барро Элит 501 160 x 200;Ортопедический матрас Барро Элит 501 160 x 200;1;0;1533502800;1534021200;<p>Ортопедический классический матрас на основе пружинного блока TFK. Симметричный матрас с традиционной компоновкой пенополиуретана с двух сторон и холстопрошивного ватина. А так же иглопробивным натуральным полотном и по периметру - 40мм пенополиуретаном. Съемный чехол матраса (стеганый жакард).</p>;Ортопедический матрас Барро Элит 501 160 x 200;Ортопедический матрас Барро Элит 501 160 x 200;957602064;231,3;231,3;0;4;Россия;0;0;0;;;;products/44-95-thickbox.jpg
431;27;Детские качели GRACO Swing'n'bounce;Детские качели GRACO Swing'n'bounce;1;1;1533502800;1534021200;<p>Уникальная модель 2-в-1: качели + кресло качалка. 6 скоростей для использования в качестве качелей. 2 скорости для спокойного покачивания в кресле качалке. 3 положения наклона кресла. Снимаемый подголовник. Движущаяся карусель с 3 плюшевыми игрушками. Электронный блок с музыкой, звуками природы, таймер для автоматического отключения. Цвета: deimos, venus, greta.</p>;Детские качели GRACO Swing'n'bounce;Детские качели GRACO Swing'n'bounce;1309142305;230;230;0;4;Россия;1;0;0;;;;products/23-47-thickbox.jpg
432;29;Факсимильный аппарат Sharp UX-73;Факсимильный аппарат Sharp UX-73;1;0;1533502800;1534021200;<p>Простой и удобный в эксплуатации факсимильный аппарат с памятью, достаточной для хранения 17 страниц. Факс, копир и телефон, собранные вместе в компактном корпусе. Печать на термобумаге. Скорость модема - до 9,6 Кбит/с. Автоподатчик на 10 листов. Автоматический набор 40 номеров. Автоматическая обрезка бумаги.</p>;Факсимильный аппарат Sharp UX-73;Факсимильный аппарат Sharp UX-73;1413789977;220,22;220,22;0;4;Россия;0;0;0;;;;products/90-155-thickbox.jpg
