csv_id;parent_id;pagetitle;longtitle;published;deleted;createdon;publishedon;content;description;introtext;article;price;old_price;weight;vendor_id;made_in;new;popular;favorite;color;tags;size;images
433;22;Краскораспылитель Bosch PFS 105 E;Краскораспылитель Bosch PFS 105 E;0;0;1533502800;1534021200;<p>Системы тонкого распыления с электронной регулировкой расхода воздуха для обработки больших объектов. Потребляемая мощность 350 Вт. Система плавной регулировки расхода краски. Сопло для распыления краски с 3 положениями. Рукоятка с мягкой накладкой. Длина шланга: 3.4 м.</p>;Краскораспылитель Bosch PFS 105 E;Краскораспылитель Bosch PFS 105 E;1861550232;220;220;30;4;Россия;0;0;1;"[""Красны"",""Сереневый"",""Голубой""]";;;products/102-186-thickbox.jpg
434;23;Автомобильная громкая связь Nokia CK-300;Автомобильная громкая связь Nokia CK-300;0;0;1533502800;1534021200;<p>Беспроводной автомобильный комплект для совершения вызовов и прослушивания музыки. Встроенная функция DSP. Индикатор питания на внешнем устройстве ввода. Активация голосовых команд (требует поддержки телефоном). Переадресация вызова с телефона на автомобильный комплект. Повтор последнего набранного номера. Отключение микрофона. Воспроизведение МР3-файлов из памяти мобильного устройства или совместимого музыкального плеера. Подключение к автомагнитоле для лучшего качества звука (требуется магнитола с разъемом AUX и адаптер кабеля).</p>;Автомобильная громкая связь Nokia CK-300;Автомобильная громкая связь Nokia CK-300;187406722;214;214;3;4;Россия;0;1;0;;;;products/107-196-thickbox.jpg
435;28;Погружной блендер Philips HR1377;Погружной блендер Philips HR1377;1;0;1533502800;1534021200;"<p>Основные характеристики:</p><p>Тип погружной</p><p>Мощность 700 Вт</p><p>Управление механическое, число скоростей: 5, плавная регулировка скорости</p><p>Особенности:</p><p>Материал корпуса металл</p><p>Материал погружной части металл</p><p>Отверстие для ингредиентов есть</p><p>Сетевой шнур длина 1.30 м</p><p>Функциональные возможности:</p><p>Дополнительные режимы турборежим</p><p>Измельчитель есть, объем 1.5 л</p><p>Мерный стакан есть, объем 1 л</p><p>Венчик для взбивания есть</p><p>Дополнительная информация диск для нарезки тонкими/средними ломтиками; диск для шинковки/нарезки</p>";Погружной блендер Philips HR1377;Погружной блендер Philips HR1377;1080163006;21130;21130;3;4;Россия;0;0;0;;;;products/2-3-thickbox.jpg
436;27;Радиотелефон DECT Siemens Gigaset S675;Радиотелефон DECT Siemens Gigaset S675;1;0;1533502800;1534021200;<p>Телефон с цветным дисплеем и 15 полифоническими мелодиями. Конференц-связь, автодозвон, автоответчик на 40 минут с дистанционным управлением с другого телефона, блокировка клавиатуры, идентификатор на 30 номеров, ответ поднятием трубки с базы, разъём для гарнитуры, уведомление о пропущенных вызовах с помощью SMS, экономичный режим, SMS. Стандарты DECT/GAP. Радиус действия в помещении до 50 метров, на открытой местности до 300. Возможно подключение до 6 трубок к одной базе и 4 баз к одной трубке.</p>;Радиотелефон DECT Siemens Gigaset S675;Радиотелефон DECT Siemens Gigaset S675;1041644229;203;203;0;4;Россия;0;0;0;;;;products/81-144-thickbox.jpg
437;27;Виброплита Сплитстоун VS-244;Виброплита Сплитстоун VS-244;1;0;1533502800;1534021200;<p>Виброплита предназначена для уплотнения асфальтобетонной смеси, грунта, щебня, песка. Идеальна при ремонте дорог, благоустройстве территории, устройстве фундаментов и инженерных сетей. Производительность виброплиты, м2/час 140. Эксплуатационная масса: 90 кг.</p>;Виброплита Сплитстоун VS-244;Виброплита Сплитстоун VS-244;851582847;2000;2000;0;4;Россия;0;0;0;;;;products/54-106-thickbox.jpg
438;23;Микросотовый телефон DECT Panasonic KX-TCA275;Микросотовый телефон DECT Panasonic KX-TCA275;0;0;1533502800;1534021200;<p>Микросотовый телефон DECT позволяет сотрудникам перемещаться по всей территории офиса, не прекращая разговора, и обеспечивают при этом полную функциональность стационарного системного телефона. Каждый микросотовый телефон DECT может быть зарегистрирован на нескольких АТС, что позволяет использовать один и тот же номер в разных офисах. Когда Вы находитесь в другом офисе, трубка автоматически регистрируется в местной DECT сети, и Вы можете принимать звонки на свой обычный внутренний номер. Цветной графический ЖК-дисплей с подсветкой и с поддержкой кириллицы. Работа с АТС Panasonic серий KX-TDA/TDE/NCP. Поддержка CTI приложений (доступность данной функции зависит от версии KX-TDA0141/0158). Поддержка функций АТС. Разъём для подключения гарнитуры. Полифонический звонок (10 мелодий). Клавиатура с подсветкой и символами кириллицы. Спикерфон. Программируемые кнопоки. Виброзвонок. Режим на совещание. Записная книжка на 200 записей. Размер: 123х45х23 мм. Вес: 115 г.</p>;Микросотовый телефон DECT Panasonic KX-TCA275;Микросотовый телефон DECT Panasonic KX-TCA275;161269464;200;200;0;4;Россия;1;0;0;"[""Красны"",""Синий"",""Оранжевый"",""Сереневый"",""Голубой""]";;;products/110-202-thickbox.jpg
439;27;Рюкзак-кенгуру GLOBEX КЕНГА;Рюкзак-кенгуру GLOBEX КЕНГА;1;0;1533502800;1534021200;<p>Предназначен для детей от 2-х до 8 месяцев (до 7,7 кг). Рюкзачок имеет два положения для переноски младенца: лицом к маме и лицом вперед. Жесткое основание подголовника поддержит и защитит головку ребенка. Благодаря специальным застежкам рюкзачок растет вместе с ребенком. Широкие ремни с прокладкой. Упаковка - прочная яркая коробка с ручкой.</p>;Рюкзак-кенгуру GLOBEX КЕНГА;Рюкзак-кенгуру GLOBEX КЕНГА;1327312986;20;20;1520;4;Россия;1;0;0;;;;products/39-87-thickbox.jpg
440;26;Видеоняня Motorola MBP 35;Видеоняня Motorola MBP 35;1;0;1533502800;1534021200;<p>Цифровая видео-радионяня с большим 3.5 дюймовым LCD дисплеем. Режим ночного видения. Режим сна для сохранения заряда. Большая зона приема с предупреждением о выходе из зоны приема. Позволяет присматривать за ребенком на расстоянии до 150 метров. Чистый звук с индикатором громкости. Цифровой термометр. Высокочувствительный микрофон. Связь в обе стороны. Пять колыбельных. Заряжаемый аккумулятор./p></p>;Видеоняня Motorola MBP 35;Видеоняня Motorola MBP 35;994570555;198;198;0;4;Россия;0;0;0;;;;products/36-81-thickbox.jpg
441;23;Мобильный телефон Porsche Design P'9521;Мобильный телефон Porsche Design P'9521;0;0;1533502800;1534021200;<p>Корпус изготовлен из алюминия. Верхнюю крышку можно поворачивать в разные стороны. Сеть: GSM / EDGE (850 / 900 / 1800 / 1900 МГц). Камера: 3.2 мегапикселя, автофокус, вспышка. Дисплей: AMOLED, 2.2 дюйма, 320 х 240 точек. USB 1.1. Bluetooth 1.2, A2DP, AVRCP. Считыватель отпечатков пальцев.</p>;Мобильный телефон Porsche Design P'9521;Мобильный телефон Porsche Design P'9521;1748485771;1965;1965;1;4;Россия;0;1;0;;;;products/106-190-thickbox.jpg
442;27;Шезлонг Canadian Camper 68014;Шезлонг Canadian Camper 68014;1;1;1533502800;1534021200;<p>СС-68014 - одно из самых лучших кресел для отдыха за городом на лоне природы.</p><p>Регулируемые по высоте подушка-подголовник кресла и патентованная система наклона спинки, позволит подобрать наиболее удобное для вас положение.</p><p>Сетчатая структура стойкого к ультрафиолетовому излучению материал кресла – HD TEXTILENE - обеспечит максимальный комфорт даже в летнюю жару. Также этот материал почти не впитывает влагу и моментально сохнет.</p><p>Пластмас, из которого сделаны подлокотники кресла, не только придает «шарм» креслу, но и обеспечивает приятные тактильные ощущения. Прочный стальной каркас кресла выдерживает нагрузку до 120 кг.</p><p>Меняется положение при помощи тела человека , в подлокотниках есть два фиксатора для наиболее удобного принятия положения.</p><p>Транспортировочное положение , положение для хранения , минимум занимаемой площади</p>;Шезлонг Canadian Camper 68014;Шезлонг Canadian Camper 68014;48202593;190;190;30;4;Россия;0;0;1;;;;products/49-101-thickbox.jpg
443;27;Ручная циркулярная пила Metabo KS 54;Ручная циркулярная пила Metabo KS 54;1;0;1533502800;1534021200;<p>Поворотный штуцер для подсоединения к внешней системе отсоса опилок. Корпус механизма привода, выполненный из алюминия методом литья под давлением. Механизм изменения угла наклона пропила в пределах 0 - 45 градусов. Механический тормоз, защита от перегрузки. Новый тип более быстроходных тонких пильных дисков, хорошо видна линия резания, эргономический дизайн.</p>;Ручная циркулярная пила Metabo KS 54;Ручная циркулярная пила Metabo KS 54;802375995;190;190;0;5;Россия;0;1;0;;;;products/63-114-thickbox.jpg
444;27;Комплект детского постельного белья в кроватку Грибок-теремок арт.758;Комплект детского постельного белья в кроватку Грибок-теремок арт.758;1;0;1533502800;1534021200;<p>Комплект в кроватку Грибок-теремок арт.758</p><p>-Бортик (по всему периметру кроватки, высота 50см)</p><p>-Балдахин (нежная вуаль, 170x300см)</p><p>-Наволочка</p><p>-Пододеяльник</p><p>-Простыня</p><p>-Одеяло (110x140см)</p><p>-Подушка (40x60см)</p><p>Ткань:</p><p>Высококачественный поплин, 100% хлопок безупречной выделки</p><p>Наполнитель:</p><p>Бортик: Поролон + Синтепон</p><p>Одеяло и подушка: Шерсть</p><p>Декор:</p><p>Вышивка на бортике и пододеяльнике</p><p>в комплект входит стойка к балдахину</p><p>отделка ручной работы шитьём, мягкими бантами и вышитой аппликацией</p><p>деликатные швы, рассчитанные на прикосновение к нежной коже ребёнка бельё полностью безопасно и гипоаллергенно</p><p>Страна происхождения - Россия</p>;Комплект детского постельного белья в кроватку Грибок-теремок арт.758;Комплект детского постельного белья в кроватку Грибок-теремок арт.758;1851023253;190;190;1500;5;Россия;1;1;0;;;;products/33-78-thickbox.jpg
445;27;Бензорез Stihl TS 700;Бензорез Stihl TS 700;1;0;1533502800;1534021200;<p>Ручной бензорез для пиления металла, бетона и асфальта. Мощность: 5 кВт. Трехступенчатая фильтрующая система. Система ElastoStart+ и антивибрационная система. Полуавтоматическое натяжение ремня.</p>;Бензорез Stihl TS 700;Бензорез Stihl TS 700;818064629;1800;1800;1;5;Россия;0;1;0;;;;products/62-113-thickbox.jpg
446;29;Универсальная соковыжималка Philips HR186630;Универсальная соковыжималка Philips HR186630;1;0;1533502800;1534021200;<p>Тип универсальная</p><p>Мощность 800 Вт</p><p>Резервуар для сока стакан, объем 1.25 л</p><p>Система прямой подачи сока есть</p><p>Система капля-стоп есть</p><p>Сбор мякоти автоматический выброс мякоти, объем резервуара 2 л</p><p>Сепаратор для пены есть</p><p>Защитные функции защита от случайного включения</p><p>Технические характеристики</p><p>Тип универсальная</p><p>Мощность 800 Вт</p><p>Резервуар для сока стакан, объем 1.25 л</p><p>Система прямой подачи сока есть</p><p>Система капля-стоп есть</p><p>Сбор мякоти автоматический выброс мякоти, объем резервуара 2 л</p><p>Сепаратор для пены есть</p><p>Защитные функции защита от случайного включения</p><p>Особенности</p><p>Материал корпуса алюминий</p><p>Материал сетки центрифуги нерж. сталь</p><p>Круглая горловина есть</p><p>Размер горловины 74 мм</p><p>Комплектация щеточка для чистки</p><p>Прорезиненные ножки есть</p><p>Отсек для сетевого шнура длина 1.2 м</p><p>Управление</p><p>Количество скоростей 2</p>;Универсальная соковыжималка Philips HR186630;Универсальная соковыжималка Philips HR186630;136098675;180,8;180,8;0;5;Россия;0;1;0;;;;products/7-14-thickbox.jpg
447;29;Хлебопечка Tefal Dual Home Baker OW4002;Хлебопечка Tefal Dual Home Baker OW4002;1;0;1533502800;1534021200;<p>Мощность 680 Вт. Запрограммированный старт через 15 часов. Запас памяти на 7 минут при сбое электропитания. Антипригарное покрытие бака. 13 программ приготовления. 3 варианта веса хлеба (750 г, 1 кг и 1,2 кг). 3 цвета корочки.</p>;Хлебопечка Tefal Dual Home Baker OW4002;Хлебопечка Tefal Dual Home Baker OW4002;318569930;180,3;180,3;0;5;Россия;0;0;0;;;;products/18-37-thickbox.jpg
448;29;Кровать BERTONI CLASSIC;Кровать BERTONI CLASSIC;1;0;1533502800;1534021200;<p>Внутренний размер кроватки: 120х60 см. Выдвижной ящик. Специальные фиксаторы качания. Варианты цветовой гаммы: голубая и розовая.</p>;Кровать BERTONI CLASSIC;Кровать BERTONI CLASSIC;1490091800;180,2;180,2;0;5;Россия;0;0;0;;;;products/28-65-thickbox.jpg
449;38;Цифровая фотокамера Olympus PEN E-P3;Цифровая фотокамера Olympus PEN E-P3;1;0;1533502800;1534021200;<p>Компактная камера в металлическом корпусе. Сенсорный OLED-дисплей с диагональю 3 дюйма. Live MOS сенсор с разрешением 12.3 Мегапикселей. FAST автофокус (Frequency Acceleration Sensor Technology). Full HD-видео со стерео звуком, регулируемой глубиной резкости и художественными фильтрами. Графический процессор TruePic VI. Цвета: черный, белый, серебристый.</p>;Цифровая фотокамера Olympus PEN E-P3;Цифровая фотокамера Olympus PEN E-P3;1952049251;1750;1750;0;5;Германия;0;0;0;;;;products/136-236-thickbox.jpg
450;29;Миксер электрический Graphite 58G782;Миксер электрический Graphite 58G782;1;0;1533502800;1534021200;<p>Миксер электрический в чемоданчике с мешалкой. Мощность 1200 Вт. Патрон M14. Скорость I: 0-580, II: 0-760 об/мин.</p>;Миксер электрический Graphite 58G782;Миксер электрический Graphite 58G782;603047154;175,5;175,5;0;5;Германия;0;0;1;;;;products/56-108-thickbox.jpg
451;27;Пароварка BORK FS ECP 98100 BK;Пароварка BORK FS ECP 98100 BK;1;1;1533502800;1534021200;<p>Общие характеристики:</p><p>Количество ярусов 3</p><p>Тип управления электронное</p><p>Максимальная потребляемая мощность 1000 Вт</p><p>Индикация включения есть</p><p>Функции:</p><p>Автоприготовление есть, рецептов - 6</p><p>Термостат есть</p><p>Отсрочка старта есть</p><p>Конструкция</p><p>Материал корпуса пластик</p><p>Материал паровых корзин прозрачный пластик</p><p>Объем резервуара для воды 1.5 л</p><p>Чаша для риса есть, на 1.9 л</p><p>Индикатор уровня воды есть</p><p>Съемные решетки есть</p><p>Дисплей есть</p><p>Долив воды во время приготовления есть</p><p>Особенности:</p><p>Габариты (ШхВхГ) 35x41x25 см</p><p>Вес 2.68 кг</p><p>Длина сетевого шнура 1 м</p>;Пароварка BORK FS ECP 98100 BK;Пароварка BORK FS ECP 98100 BK;1011310273;175;175;1520;5;Германия;0;0;0;;;;products/6-13-thickbox.jpg
452;27;Цифровой системный телефон LG-Nortel LDP-7016D;Цифровой системный телефон LG-Nortel LDP-7016D;1;0;1533502800;1534021200;<p>Системный телефон с 16 программируемыми клавишами со световой индикацией. Трехстрочный информационный дисплей. 3 контекстные клавиши. Клавиши быстрой навигации. Спикерфон (громкая связь). Поддержка дочерних модулей. Световой индикатор вызова./p></p>;Цифровой системный телефон LG-Nortel LDP-7016D;Цифровой системный телефон LG-Nortel LDP-7016D;1567793084;175;175;0;5;Германия;1;0;1;;;;products/84-148-thickbox.jpg
453;27;Пеленальный столик Cam Nuvola;Пеленальный столик Cam Nuvola;1;1;1533502800;1534021200;<p>Пеленальный столик с ванночкой для купания. Система безопасности предотвращающая произвольное складывание. Две полочки для детских вещей. Изделие предназначено для детей от 0 до 12 месяцев. Различная цветовая гамма.</p>;Пеленальный столик Cam Nuvola;Пеленальный столик Cam Nuvola;2075759371;161;161;0;5;Германия;0;0;0;;;;products/32-74-thickbox.jpg
454;27;Электрический чайник Stadler Form SFK.808;Электрический чайник Stadler Form SFK.808;1;0;1533502800;1534021200;<p>Электрочайник емкостью 1.8 литра в стеклянном корпусе с закрытым нагревательным элементом. Стеклянная колба Duran Schott и голубая подсветка превратят процесс закипания воды в волшебное зрелище. Мощность 2200 Вт обеспечит быстрое закипание, а центральный контакт - поворот на 360 градусов и удобную эксплуатацию. Чайник оснащен съемным фильтром-сеткой, для безопасного использования предусмотрена блокировка крышки. Основание, ручка и крышка чайника изготовлены из прочного пластика. Электрический шнур убирается в специальный отсек.</p>;Электрический чайник Stadler Form SFK.808;Электрический чайник Stadler Form SFK.808;1716268135;160;160;300;5;Германия;0;0;0;;;;products/17-31-thickbox.jpg
